<?xml version="1.0" encoding="UTF-8"?>
<dataset xmlns="https://www.musicstore.com"
         xmlns:xsi="http://www.w3.org/2001/XMLSchema-instance"
         xsi:schemaLocation="https://www.musicstore.com ../../schema/test-data-schema.xsd">

    <GENRE id="1"/>
        <GENRE id="2" parent_genre_id="1"/>
            <GENRE id="3" parent_genre_id="2"/>
                <ARTIST id="1" genre_id="3"/>
                <ARTIST id="2" genre_id="3"/>
                <ARTIST id="3" genre_id="3"/>
            <GENRE id="4" parent_genre_id="2"/>
                <ARTIST id="4" genre_id="4"/>

</dataset>